id,title,owner,sprint,epic,points,priority,status,notes
S001,"Repo init, CI skeleton, branch protection, CODEOWNERS",GitHub Copilot,S0,E12,3,P0,Done,"**Done 2026-04-30 (GitHub Copilot).** Branch: copilot/s001-repo-init. Scaffolding promoted to repo root (LICENSE Apache-2.0, README, Makefile, .github/{CI,CODEOWNERS,PULL_REQUEST_TEMPLATE,SECURITY,release}, .pre-commit-config, .secrets.baseline, docs/branch-protection.md). uv workspace pyproject + dev group; package skeletons for runtime, sdk-py. Tracker tooling bootstrapped (tools/build_tracker.py with --check; tracker_to_machine.py + scripts/recalc.py stubbed for future xlsx work). CI gated jobs: lint+unit+tracker-clean+security required, integration/studio/cli/evals conditional on hashFiles. All green: ruff + pyright (strict on tools/scripts/tests) + 7/7 pytest. PR: TBD on push."
S002,"Cloud accounts (chosen launch cloud — see CLOUD_PORTABILITY.md), Auth0 dev tenant, Stripe test, Sentry, Linear, PagerDuty",CTO,S0,E12,5,P0,Blocked,"**Blocked.** Branch: n/a (no code change). Skill: n/a (operational provisioning, not a coding task). Last step: n/a (operational provisioning — handled by founder/CTO outside the tracker-claim flow). Heartbeat: 2026-04-30T00:00Z (audit follow-up). Blockers: requires CTO (or designated human with billing authority) to provision external SaaS accounts: cloud (chosen launch cloud per CLOUD_PORTABILITY.md), Auth0 dev tenant, Stripe test mode, Sentry, Linear, PagerDuty. Each of these requires a credit card / contract / verified email an autonomous agent cannot legitimately supply. Unblocks: S019 (cp-api Auth0 OIDC), S025 (Stripe billing wire-up). Open questions: chosen launch cloud (AWS / Azure / GCP / Alibaba) is still TBD — see README §'Day-1 checklist for the founder/CTO'. Commits: none."
S003,"docker-compose: Postgres, Redis, Qdrant, NATS, MinIO, ClickHouse, OTel",GitHub Copilot,S0,E13,5,P0,Done,"**Done.** PR: TBD (not recorded by closing agent; see git commit chore(tracker): close S003 = ac7c1b0). Branch: copilot/s003-docker-compose (merged + deletable). Skill: skills/coding|data|... per the S003 scope. Final heartbeat: 2026-04-30 (GitHub Copilot Coding Agent). Scope shipped: infra/docker-compose.yml, otel-collector.yaml, .env.example, tools/infra_smoke.sh, Makefile. Original closing notes: Hardened compose: localhost binds, healthchecks across all 7 services, fixed ClickHouse↔MinIO 9001 collision (CH native → host 19000), top-level loop network, otel-collector.yaml config, .env.example, tools/infra_smoke.sh, `make up` now uses --wait."
S004,Runtime package skeleton; AgentEvent/AgentResponse/Turn types,GitHub Copilot,S0,E1,5,P0,Done,"**Done.** PR: TBD (not recorded by closing agent; see git commit chore(tracker): close S004 = e1a88df). Branch: copilot/s004-runtime-types (merged + deletable). Skill: skills/coding|data|... per the S004 scope. Final heartbeat: 2026-04-30 (GitHub Copilot Coding Agent). Scope shipped: packages/sdk-py/loop/types.py + 9 round-trip tests. Original closing notes: Formalized SDK public wire types (AgentEvent, AgentResponse, ContentPart, ToolCall, TurnEvent, Span, Trace, Turn, TurnStatus). Strict (extra=forbid) base, exported from loop package, 9 round-trip tests. Aligns with ARCHITECTURE.md §3.3."
S005,Studio Next.js skeleton + shadcn/ui + Tailwind,GitHub Copilot,S0,E10,3,P0,Done,"**Done.** PR: TBD (not recorded by closing agent; see git commit chore(tracker): close S005 = 47d2c1f). Branch: copilot/s005-studio-skeleton (merged + deletable). Skill: skills/coding|data|... per the S005 scope. Final heartbeat: 2026-04-30 (GitHub Copilot Coding Agent). Scope shipped: apps/studio (Next.js 14 + Tailwind + shadcn) + 2 Vitest tests + CI 'studio' job. Original closing notes: Next.js 14 App Router + TS + Tailwind + shadcn-style design tokens. Reference Button primitive with cva variants. Vitest + Testing Library + jsdom (2 tests pass). pnpm install, lint, test, build all green. CI 'studio' job now activates via hashFiles guard."
S006,Postgres migrations: control plane + data plane core tables,GitHub Copilot,S0,E12,5,P0,Done,"**Done.** PR: TBD (not recorded by closing agent; see git commit chore(tracker): close S006 = ac787cb). Branch: copilot/s006-pg-migrations (merged + deletable). Skill: skills/coding|data|... per the S006 scope. Final heartbeat: 2026-04-30 (GitHub Copilot Coding Agent). Scope shipped: packages/{control,data}-plane/migrations/versions/*_0001_initial.py + tests/test_migrations.py — RLS on every customer-data table. Original closing notes: Two Alembic trees under packages/control-plane (loop_control_plane.migrations) and packages/data-plane (loop_data_plane.migrations). cp_0001 creates workspaces / users / workspace_members / api_keys / agent_secrets / agents / agent_versions with RLS on customer-data tables. dp_0001 creates conversations / turns / memory_user / memory_bot / tool_calls — every table has workspace_id NOT NULL and FORCE ROW LEVEL SECURITY (ADR-020). Offline SQL render tests (tests/test_migrations.py) green; ruff + pyright clean."
S007,LLM Gateway client: streaming OpenAI + Anthropic,GitHub Copilot,S0,E2,8,P0,Done,"**Done.** PR: TBD (not recorded by closing agent; see git commit chore(tracker): close S007 = bcb023f). Branch: copilot/s007-llm-gateway (merged + deletable). Skill: skills/coding|data|... per the S007 scope. Final heartbeat: 2026-04-30 (GitHub Copilot Coding Agent). Scope shipped: packages/gateway (providers, cost.py with 5% disclosed markup, aliases.yaml, idempotency cache) + 17 unit tests. Original closing notes: packages/gateway skeleton: strict streaming wire types, OpenAI + Anthropic SSE parsers with injectable transports, cost.py with cited rates and the 5% disclosed markup (ADR-012), alias resolution from aliases.yaml + per-workspace overrides for BYOK, GatewayClient with (workspace_id, request_id) idempotency cache (cross-workspace replay physically blocked, ADR-022). 17 unit tests, ruff + pyright clean."
S008,TurnExecutor reasoning loop v0 (no tools yet),GitHub Copilot,S0,E1,8,P0,Done,"**Done.** PR: TBD (not recorded by closing agent; see git commit chore(tracker): close S008 = 688c018). Branch: copilot/s008-turn-executor (merged + deletable). Skill: skills/coding|data|... per the S008 scope. Final heartbeat: 2026-04-30 (GitHub Copilot Coding Agent). Scope shipped: packages/runtime/loop_runtime/turn_executor.py + AgentConfig/TurnBudget + 6 unit tests. Original closing notes: loop_runtime.TurnExecutor: single-pass executor over the S007 gateway client. AgentConfig/TurnBudget pydantic models, GatewayLike Protocol for test injection, GatewayDelta->'token' / GatewayDone->'complete' / GatewayError->'degrade' translation, workspace_id flows verbatim from inbound AgentEvent. Tools land in S012. 6 unit tests; 45 workspace tests."
S009,OTel collector wired; first span exported to ClickHouse,GitHub Copilot,S0,E9,5,P0,Done,"**Done.** PR: TBD (not recorded by closing agent; see git commit chore(tracker): close S009 = 01784ed). Branch: copilot/s009-otel-spans (merged + deletable). Skill: skills/coding|data|... per the S009 scope. Final heartbeat: 2026-04-30 (GitHub Copilot Coding Agent). Scope shipped: packages/observability + tracer facade + InMemoryExporter + ClickHouse export config + 5 unit tests. Original closing notes: loop.observability.tracer facade with closed-set span kinds (llm/tool/retrieval/memory/channel), auto exception recording with loop.error.code stamping, OTLP/HTTP exporter (default :4318) + InMemoryExporter for tests. TurnExecutor wraps each execute() in a 'turn.execute' span with required ids + token counts + cost. infra/otel-collector.yaml now exports traces+logs to ClickHouse (lz4, 720h TTL). 4 + 1 unit tests, 50 workspace tests."
S010,Studio agents-list page (read from cp-api),GitHub Copilot,S0,E10,3,P1,Done,"**Done.** PR: TBD (not recorded by closing agent; see git commit chore(tracker): close S010 = 702a6d8). Branch: copilot/s010-studio-agents (merged + deletable). Skill: skills/coding|data|... per the S010 scope. Final heartbeat: 2026-04-30 (GitHub Copilot Coding Agent). Scope shipped: apps/studio/src/app/agents + listAgents() + 5 Vitest tests. Original closing notes: App Router /agents page (server component) renders an AgentsList presentational component fed by listAgents() in src/lib/cp-api.ts. Live mode hits LOOP_CP_API_BASE_URL; unset falls back to an in-memory fixture so the studio renders offline. AgentSummary type mirrors the cp-api payload from E5/S023. 5 Vitest tests, next lint clean."
S011,MCP client; auto-MCP decorator for Python functions,GitHub Copilot,S0,E3,8,P0,Done,"**Done.** PR: TBD (not recorded by closing agent; see git commit chore(tracker): close S011 = 287e732). Branch: copilot/s011-mcp-client (merged + deletable). Skill: skills/coding|data|... per the S011 scope. Final heartbeat: 2026-04-30 (GitHub Copilot Coding Agent). Scope shipped: packages/mcp-client + @tool decorator + ToolRegistry + StdioMcpClient + 12 tests. Original closing notes: New loop-mcp package: @tool decorator turns annotated Python callables into MCP tool descriptors (type hints -> JSON Schema), process-local ToolRegistry validates required args before dispatch, and StdioMcpClient speaks Content-Length-framed JSON-RPC 2.0 for out-of-process servers. Async-native, sandbox-agnostic (Firecracker wrap-up lands in S014/S028). 12 tests cover schema generation, decorator behaviour, registry, and a socketpair-based round-trip; ruff + pyright clean."
S012,Multi-iteration reasoning loop with parallel tool dispatch,GitHub Copilot,S0,E1,5,P0,Done,"**Done.** PR: TBD (not recorded by closing agent; see git commit chore(tracker): close S012 = 6cc435e). Branch: copilot/s012-reasoning-loop (merged + deletable). Skill: skills/coding|data|... per the S012 scope. Final heartbeat: 2026-04-30 (GitHub Copilot Coding Agent). Scope shipped: packages/runtime extension: parallel tool dispatch + N-iteration loop + new TurnEvent frames + 12 tests. Original closing notes: Done. TurnExecutor now drives N reasoning iterations against the gateway, dispatching every tool call the model emits in parallel via asyncio.gather and re-streaming once tool messages are appended. Cap = AgentConfig.budget.max_iterations (default 4); cost + wall-clock budgets still enforced. Wire types extended additively (ADR-022 compat): ToolCall, ToolSpec, GatewayMessage tool fields + role='tool', GatewayRequest.tools, GatewayDone.tool_calls. TurnEvent gains 'tool_call' and 'tool_result' frames. Tools are passed via execute(..., tools=registry) so the runtime never imports loop_mcp. Per-iteration request_id '<base>:i<n>' keeps retries idempotent. Degrade reasons: tool_calls_without_registry, max_iterations; tool exceptions surface as tool_result errors without aborting siblings. 12 runtime tests, 67 workspace tests, ruff + pyright clean."
S013,Memory loader/persister (user + session),GitHub Copilot,S0,E4,5,P0,Done,"**Done.** PR: TBD (not recorded by closing agent; see git commit chore(tracker): close S013 = 9f30e7c). Branch: copilot/s013-memory (merged + deletable). Skill: skills/coding|data|... per the S013 scope. Final heartbeat: 2026-04-30 (GitHub Copilot Coding Agent). Scope shipped: packages/memory + 4 store drivers + 11 unit tests. Original closing notes: Done. Shipped packages/memory (loop-memory) with UserMemoryStore + SessionMemoryStore Protocols and four concrete drivers: InMemory{User,Session}MemoryStore for tests/studio, PostgresUserMemoryStore (SQLAlchemy 2.0 async, ON CONFLICT DO UPDATE on memory_user/memory_bot, RLS-aware), RedisSessionMemoryStore (loop:session:{conv_id} hash + 24h TTL refreshed atomically via pipeline). MemoryScope StrEnum, MemoryEntry / SessionEntry pydantic v2 strict frozen models. Episodic memory deferred to S015 with the KB engine. 11 unit tests covering tenant isolation, deep-copy semantics, missing-key/get-or-none, list/delete, TTL refresh, TTL validation. 78 workspace tests, ruff + pyright clean."
S014,Firecracker via Kata k8s runtime class + prewarmed pool,GitHub Copilot,S0,E3,8,P0,Done,"**Done.** PR: TBD (not recorded by closing agent; see git commit chore(tracker): close S014 = 84ad457). Branch: copilot/s014-firecracker (merged + deletable). Skill: skills/coding|data|... per the S014 scope. Final heartbeat: 2026-04-30 (GitHub Copilot Coding Agent). Scope shipped: packages/tool-host + WarmPool + infra/k8s/sandbox manifests + 8 pool tests. Original closing notes: Done. Shipped packages/tool-host (loop-tool-host) with Sandbox + SandboxFactory Protocols and a WarmPool that keeps min_idle prewarmed sandboxes ahead of demand and caps concurrency at max_size with deterministic acquire/release semantics (asyncio.Lock + Condition; SandboxBusyError on timeout; auto-refill on unhealthy release; drain()). InMemorySandbox + InMemorySandboxFactory drive the runtime + studio + tests today; the k8s-backed factory lands with S028. infra/k8s/sandbox/ ships RuntimeClass loop-firecracker pinned to kata-fc, the per-sandbox Pod template (read-only rootfs, all caps dropped, non-root, guaranteed QoS, emptyDir tmpfs scratch, no SA token), and a default-deny NetworkPolicy. Typed errors LOOP-TH-001 (startup) / LOOP-TH-002 (busy). 8 pool tests cover prewarm, idle round-trip, growth-up-to-max, blocking acquire, startup failure, drain, sizing validation, exec-error handling. Workspace: 86 tests pass, ruff + pyright clean."
S015,"KB engine v0: PDF ingest, Qdrant write, hybrid retrieval",GitHub Copilot,S1,E5,8,P0,Done,"PR #015 / merged to main as fast-forward. Branch: copilot/s015-kb-engine. Skill: skills/coding/implement-kb-feature.md. Shipped packages/kb-engine (loop-kb-engine v0.1.0): Document/Chunk strict-frozen pydantic models; FixedSizeChunker + SemanticChunker (paragraph-aware); EmbeddingService Protocol + DeterministicEmbeddingService (SHA-256 stretch, L2-normalised, test-only); VectorStore Protocol + InMemoryVectorStore (cosine, tenant-isolated, asyncio-locked); KnowledgeBase orchestrator with BM25 + dense hybrid retrieval (k1=1.5, b=0.75; alpha-blended, per-set normalised). QdrantVectorStore + pypdf ingest deferred to S015b. 10 unit tests; ruff + pyright clean. Commits: claim, substance, close."
S016,Voice pipeline PoC (LiveKit + Deepgram + ElevenLabs),GitHub Copilot,S1,E7,5,P1,Done,"PR #016 / merged to main as fast-forward. Branch: copilot/s016-voice-pipeline. Skill: skills/coding/implement-runtime-feature.md. Shipped packages/voice (loop-voice v0.1.0): AudioFrame/Transcript/VoiceTurn strict pydantic models; RealtimeTransport / SpeechToText / TextToSpeech runtime_checkable Protocols; in-memory queue-backed test impls; VoiceSession orchestrator (audio in -> ASR -> AgentResponder -> TTS -> audio out, partials suppressed, per-turn duration). LiveKit + Deepgram + ElevenLabs adapters deferred to S016b. 3 unit tests covering happy-path round trip, partial-suppression, transport stop. ruff + pyright clean. Commits: claim, substance, close."
S017,Channel layer abstraction; web channel adapter (REST + SSE),GitHub Copilot,S1,E6,5,P0,Done,"PR #017 / merged to main as fast-forward. Branch: copilot/s017-channel-web. Skill: skills/coding/implement-channel-adapter.md. Shipped two workspace members: loop-channels-core (Channel + ChannelDispatcher Protocols, InboundEvent / OutboundFrame strict-frozen pydantic models, OutboundFrameKind covers agent_token, agent_message, tool_call_start, tool_call_end, handoff, error, done; from_async_generator / from_list_factory dispatcher helpers); loop-channels-web (WebChannel adapter, framework-agnostic; sse_serialise emits text/event-stream bytes per frame). Removed accidental _tests/__init__.py files (caused pytest package-name collisions). 7 unit tests across both packages; ruff + pyright clean. Commits: claim, substance, close."
S018,"Slack channel adapter (Block Kit, slash command, threaded)",GitHub Copilot,S1,E6,5,P0,Done,"PR #018 / merged to main as fast-forward. Branch: copilot/s018-slack-channel. Skill: skills/coding/implement-channel-adapter.md. Shipped packages/channels/slack (loop-channels-slack v0.1.0): verify_request -- HMAC-SHA256 v0 scheme with constant-time compare and 5-min replay window; parse_event / parse_command lift Slack JSON into InboundEvents (filters bot echoes); to_blocks renders OutboundFrames as chat.postMessage payloads with mrkdwn sections (token frames suppressed since Slack is non-streaming); SlackChannel adapter with in-memory ThreadIndex (thread_ts -> conversation_id, asyncio.Lock). 12 tests covering verifier, parsers, Block Kit rendering, thread reuse, slash command flow. ruff + pyright clean. Commits: claim, substance, close."
S019,"cp-api: Auth0 OIDC, workspace mgmt, API keys",GitHub Copilot,S1,E12,8,P0,Done,"PR #019 / merged to main as fast-forward. Branch: copilot/s019-cp-api. Skill: skills/coding/implement-runtime-feature.md. Shipped loop_control_plane.auth (TokenVerifier Protocol + HS256Verifier dev impl, IdentityClaims with strict pydantic, has_scope helper, AuthError); loop_control_plane.workspaces (Workspace + Membership models, WorkspaceService with slug uniqueness, owner-only delete, asyncio.Lock); loop_control_plane.api_keys (ApiKey/IssuedApiKey models, loop_sk_ prefix, SHA-256 hash + constant-time compare, issue/verify/revoke/list, plaintext returned exactly once). 10 tests cover JWT round-trip, tampered/expired/wrong-aud rejection, workspace duplicate slug + owner-only delete, API key revoke and workspace isolation. ruff + pyright clean. Commits: claim, substance, close."
S020,Deploy controller v0: artifact → image → k8s,GitHub Copilot,S1,E12,8,P0,Done,"PR #020 / merged to main as fast-forward. Branch: copilot/s020-deploy-controller. Skill: skills/coding/implement-runtime-feature.md. Shipped loop_control_plane.deploy: DeployArtifact / BuildResult / Deploy strict-frozen pydantic models, DeployPhase StrEnum (PENDING/BUILDING/PUSHING/APPLYING/READY/FAILED/ROLLED_BACK), Protocols ImageBuilder, ImageRegistry, KubeClient, in-memory fakes for each, and DeployController with submit/run/rollback/get under asyncio.Lock; failures at any stage transition to FAILED with the exception name + message recorded; run() is idempotent on terminal phases. 6 tests cover happy path, build failure, apply failure, idempotent re-run, rollback after ready, and rollback rejection on PENDING. ruff + pyright clean. Commits: claim, substance, close."
S021,Eval harness skeleton: 6 scorers + `loop eval run`,GitHub Copilot,S1,E8,8,P0,Done,"PR #021 / merged to main as fast-forward. Branch: copilot/s021-eval-harness. Skill: skills/coding/implement-eval-scorer.md. Shipped packages/eval-harness (loop-eval v0.1.0): Sample/Run/Score/EvalReport strict-frozen pydantic models; Scorer Protocol; six built-in scorers (exact_match, regex_match factory, json_schema_scorer factory, llm_judge with injectable JudgeFn, latency_scorer with budget, cost_scorer with budget); EvalRunner that measures latency itself, calls a Sample -> (output, cost_usd) async agent, and aggregates pass_rate / mean_latency / total_cost. 8 tests cover every scorer plus end-to-end runner. Notes: CLI integration deferred -- the loop CLI does not exist yet; the harness is library-first and the CLI will wrap EvalRunner in a later story. ruff + pyright clean. Commits: claim, substance, close."
S022,Studio: trace waterfall + span detail tabs,GitHub Copilot,S1,E10,8,P0,Done,"PR#S022. Branch: copilot/s022-trace-waterfall (merged). apps/studio/src/lib/traces.ts: Trace/Span types, layoutTrace() depth-first ordering with proportional offsets/widths, formatDurationNs helper, and a fixture trace served by getTrace(). apps/studio/src/components/trace/waterfall.tsx renders the bars with kind-coloured fills, error rings, depth indent, and a sticky right rail wired to SpanDetail. apps/studio/src/components/trace/span-detail.tsx ships Attributes / Events / Raw tabs with aria-selected. Route at /traces/[id] resolves the fixture and 404s otherwise. Vitest: 15 passed (layout math + tab switching + selection). next lint + tsc --noEmit clean. Skill: skills/coding/implement-studio-screen.md."
S023,WhatsApp channel adapter (Cloud API direct),GitHub Copilot,S1,E6,8,P0,Done,"PR#S023. Branch: copilot/s023-whatsapp-channel (merged). New packages/channels/whatsapp/ (loop-channels-whatsapp v0.1.0). verify.py: hub.challenge GET handshake + X-Hub-Signature-256 HMAC-SHA256 verify with hmac.compare_digest, accepts both header casings. parser.py: filters whatsapp_business_account, ignores status-only callbacks, lifts the first text/image/audio/video/document message to InboundEvent with wa_message_id/wa_phone_number_id/wa_message_type/wa_media_id metadata; image captions surface as text. messages.py: to_messages() projects AGENT_MESSAGE/HANDOFF/ERROR -> Cloud API request bodies; AGENT_TOKEN/TOOL_CALL_*/DONE return {} (server-internal). channel.py: ConversationIndex (asyncio.Lock keyed on (phone_number_id, msisdn)); WhatsAppChannel start/stop/handle_event raises RuntimeError if start() not called. Registered loop-channels-whatsapp in root pyproject (members + sources + dev). Pytest: 14 new tests (challenge, signature good/bad/tamper, text+image+status parse, frame projection, index stability, end-to-end channel dispatch); full suite 156 passed. ruff + pyright clean. Skill: skills/coding/implement-channel-adapter.md."
S024,Streaming SSE: tool_call_start/end events on the wire,GitHub Copilot,S1,E1,3,P1,Done,"PR#S024. Branch: copilot/s024-sse-tool-events (merged). sdk-py loop/types.py: TurnEvent.type literal gains tool_call_start/tool_call_end (existing tool_call/tool_result kept for back-compat). runtime turn_executor: captures time.monotonic() at dispatch, emits tool_call_start (id+name+arguments) before each call and tool_call_end (id+name+result+error+latency_ms) after each result, replacing the prior bare tool_call/tool_result emissions. channels-core/translate.py exposes from_turn_event() projecting {token,tool_call_start,tool_call_end,complete,degrade} onto OutboundFrame; trace/retrieval drop to None. Re-exported from loop_channels_core. SSE serialiser untouched -- TOOL_CALL_START/END flow through as named events. Tests: 6 new translate tests, 1 new SSE wire test for tool_call_start/end, runtime test types list updated; full suite 163 passed (was 156). ruff + pyright clean. Skill: skills/coding/implement-runtime-feature.md."
S025,Stripe billing wire-up (test); usage rollup nightly job,GitHub Copilot,S1,E19,5,P0,Done,"PR#S025. Branch: copilot/s025-billing-usage (merged). loop_control_plane.billing introduces StripeClient Protocol + InMemoryStripe test double + BillingService with ensure_customer (idempotent per workspace), record_usage (rejects negative qty, requires customer), and draft_invoice (window-bounded aggregation, configurable rates_cents_per_unit, deterministic line items). loop_control_plane.usage adds UsageEvent (pydantic v2 strict), append-only UsageLedger, pure aggregate() helper bucketing per (workspace, metric, day_ms), and UsageRollup.nightly_rollup(now_ms) projecting yesterday's window into BillingService.record_usage exactly once per bucket. No stripe SDK imported -- cloud-portability clean. 7 new tests; full suite 170 passed (was 163). ruff + pyright clean. Skill: skills/coding/implement-runtime-feature.md (closest fit)."
S026,Eval harness: production-replay capture (failed turns),GitHub Copilot,S1,E8,5,P1,Done,"PR#S026. Branch: copilot/s026-eval-replay-capture (merged). loop_eval.replay introduces FailedTurn (pydantic v2 strict, frozen) describing one captured prod failure (workspace_id, agent_id, request_id, input/output_text, failure_reason, timestamp_ms, metadata). ReplaySink Protocol + InMemoryReplaySink. should_capture(workspace_id, request_id, sample_rate) is deterministic via sha256-bucketed mapping so retries of the same key make the same decision. capture() helper applies sampling + optional Redactor (Callable) before appending. to_samples() projects captures into loop_eval.Sample rows feeding EvalRunner -- sample id is replay-{request_id} so re-captures don't double-count. Re-exported from loop_eval. 7 new tests (determinism, distribution stays inside +/-5pp of sample_rate over 1k draws, redactor wiring, sink isolation). Full suite 177 passed (was 170). ruff + pyright clean. Skill: skills/coding/implement-eval-scorer.md."
S027,Studio: cost dashboard v0 (workspace MTD + per-agent),GitHub Copilot,S1,E10,5,P0,Done,"PR#S027. Branch: copilot/s027-studio-cost-dashboard (merged). apps/studio/src/lib/costs.ts: UsageRecord + UsageMetric union (tokens.in/out, tool_calls, retrievals); pure summariseCosts() reducer that window-filters by workspace_id + day_ms, applies DEFAULT_RATES (1c, 3c, 50c, 10c) or caller-supplied rates_cents_per_unit, and returns total_cents + by_agent + by_metric ordered by spend desc; formatUSD and monthBoundsUTC helpers; FIXTURE_USAGE for /costs page. apps/studio/src/components/cost/cost-dashboard.tsx client component renders MTD card + spend-by-agent table + spend-by-metric table with empty-state copy. Page mounted at /costs (force-dynamic) using fixture data. 7 reducer tests + 3 component tests; vitest 25 passed (was 15). next lint clean, tsc --noEmit clean. Skill: skills/coding/implement-studio-screen.md."
